{"bindings":{"a1_anchor_sha256":"sha256:9bdadcd01077cdd2ea892a773fa54f2b83ad64e29d913f7874809e862f81c477","plan_sha256":"sha256:bd0b6d5887bacbe78a0e31c3c8cb600001a8efb34507381e9157b20ae5072e12","post_purge_tombstone_sha256":"sha256:74655fc1682ed13bfeeaefd25604403b1fa95c79072564b8abf3b6b81f9cffb2","preedit_policy_sha256":"sha256:58c757172ca0c7bb667f7b1291a09d9ec8e37866fe6cd04d903037a5a8bd5c85","selector_manifest_sha256":"sha256:6c19fddc893e313acb89bb14d878988699c1d1d29b0e2355d00ad69a98926305","source_census_sha256":"sha256:d1e6a55a20e0b671f1cd6ec7b265ba7acbe78f4b7bb22c976a9857dcae6b50f6"},"evidence_status":"approved","record_sha256":"sha256:f8e0a807709b7415458820795026695fd22672c31541ee8026acbe8a8245ac37","reviews":[{"bindings":{"a1_anchor_sha256":"sha256:9bdadcd01077cdd2ea892a773fa54f2b83ad64e29d913f7874809e862f81c477","plan_sha256":"sha256:bd0b6d5887bacbe78a0e31c3c8cb600001a8efb34507381e9157b20ae5072e12","preedit_policy_sha256":"sha256:58c757172ca0c7bb667f7b1291a09d9ec8e37866fe6cd04d903037a5a8bd5c85","selector_manifest_sha256":"sha256:6c19fddc893e313acb89bb14d878988699c1d1d29b0e2355d00ad69a98926305","source_census_sha256":"sha256:d1e6a55a20e0b671f1cd6ec7b265ba7acbe78f4b7bb22c976a9857dcae6b50f6"},"review_kind":"specification","review_view_path":"artifacts/review/es-f1-large-scope-amendment-plan-specification-review.md","review_view_sha256":"sha256:8fbbc1cbab8f50d86f7c3e5e45c26d3b95bee59e9090fb25f7f71b8d39a3f0a7","reviewed_at":"2026-08-05T00:34:26-07:00","reviewer":"codex:/root/f1_task0_spec_review","verdict":"ES_F1_SCOPE_AMENDMENT_PLAN_SPEC_APPROVED"},{"bindings":{"a1_anchor_sha256":"sha256:9bdadcd01077cdd2ea892a773fa54f2b83ad64e29d913f7874809e862f81c477","plan_sha256":"sha256:bd0b6d5887bacbe78a0e31c3c8cb600001a8efb34507381e9157b20ae5072e12","preedit_policy_sha256":"sha256:58c757172ca0c7bb667f7b1291a09d9ec8e37866fe6cd04d903037a5a8bd5c85","selector_manifest_sha256":"sha256:6c19fddc893e313acb89bb14d878988699c1d1d29b0e2355d00ad69a98926305","source_census_sha256":"sha256:d1e6a55a20e0b671f1cd6ec7b265ba7acbe78f4b7bb22c976a9857dcae6b50f6"},"review_kind":"quality","review_view_path":"artifacts/review/es-f1-large-scope-amendment-plan-quality-review.md","review_view_sha256":"sha256:110d05e8755846d16bdd1b50829d76fce39524ffa7f2269198a2a41933783f0d","reviewed_at":"2026-08-05T00:43:12-07:00","reviewer":"codex:/root/f1_task0_quality_review","verdict":"ES_F1_SCOPE_AMENDMENT_PLAN_QUALITY_APPROVED"}],"schema_version":"es_f1_task0_review_adoption.v1"}
